{
  "status": "success",
  "vault": "vault-demo",
  "project": "Projects/Demo.md",
  "period_id": "2026-W30",
  "window": {"timezone": "Asia/Shanghai", "start": "2026-07-20", "end": "2026-07-26", "inclusive": true},
  "baseline": null,
  "sources": [
    {"id": "S1", "role": "project", "path": "Projects/Demo.md", "revision": "sha256:aaaaaaaaaaaaaaaaaaaaaaaaaaaaaaaaaaaaaaaaaaaaaaaaaaaaaaaaaaaaaaaa", "date": "", "query": "", "scope": "", "selection_reason": "explicit"}
  ],
  "evidence": [
    {"id": "E1", "source_id": "S1", "path": "Projects/Demo.md", "revision": "sha256:aaaaaaaaaaaaaaaaaaaaaaaaaaaaaaaaaaaaaaaaaaaaaaaaaaaaaaaaaaaaaaaa", "location": "## Goals", "excerpt": "Ship V2"}
  ],
  "progress": [
    {"id": "I1", "category": "progress", "statement": "V2 正在推进", "epistemic_status": "source_statement", "evidence_ids": ["E1"]}
  ],
  "risks": [],
  "decisions": [],
  "next_steps": [],
  "writeback": {"requested": false, "status": "not_requested", "revision_before": "", "revision_after": ""},
  "writeback_plan": {"section": "Status", "payload_digest": "", "expected_digest": "", "planned_revision_after": "", "request_id": "", "sources_verified_at": ""},
  "verified": {"period_heading_count": 0, "payload_count": 0, "sources_current": true},
  "warnings": [],
  "errors": []
}
